{"run":54,"commit":"676fa0b","metric":85.796036,"metrics":{"success_count":100,"observed_runs":100,"pregrasp_median_s":29.749322,"batch_wall_s":1099.8},"status":"discard","description":"Repeat Stage 8 10 cm lift-test on 100/10: 100/100 confirmed, but median planner 85.80 s exceeded validated 85.26 s.","timestamp":1788213971997,"segment":5,"confidence":7.434201457420962,"asi":{"hypothesis":"The 10 cm Stage 8 lift-test speedup should reproduce on an independent 100-seed batch before further reduction.","result":"100/100 confirmed; runtime variation did not beat 85.26 s, so no additional optimization claim.","rollback_reason":"Primary metric did not improve over validated 10 cm candidate; automatic discard restored no code changes.","next_action_hint":"Keep 10 cm target. Do not reduce lift-test height without stronger evidence."}}
{"run":55,"commit":"221eb2c","metric":85.073319,"metrics":{"success_count":100,"observed_runs":100,"pregrasp_median_s":29.522783,"batch_wall_s":1088.2},"status":"keep","description":"Reduced Stage 8 lift-test height 10→8 cm; 100/100 and median planner 85.26→85.07 s.","timestamp":1788215142697,"segment":5,"confidence":7.386000079372305,"asi":{"hypothesis":"The 10 cm lift-test passed twice; 8 cm remains 3 cm above the +5 cm cup-rise gate and should shorten the verified arm lift without changing attachment validation.","result":"100/100 preserved on 100 seeds. Median planner improved 0.2% to 85.07 s; no benchmark-specific seed logic or evaluation changes.","next_action_hint":"Keep 8 cm provisionally. Repeat 100/10 before considering any lower lift-test height."}}
{"run":56,"commit":"221eb2c","metric":85.12764,"metrics":{"success_count":100,"observed_runs":100,"pregrasp_median_s":29.351367,"batch_wall_s":1089.3},"status":"discard","description":"Repeat Stage 8 8 cm lift-test on 100/10: 100/100 confirmed, median planner 85.13 s versus best 85.07 s.","timestamp":1788216268089,"segment":5,"confidence":7.075007423707942,"asi":{"hypothesis":"The 8 cm lift-test speedup should reproduce on a second 100-seed batch before considering a lower target.","result":"100/100 confirmed; runtime variation was slightly above best, so no new improvement claim.","rollback_reason":"Primary metric did not beat validated 85.07 s; code remains at 8 cm from accepted run.","next_action_hint":"Keep 8 cm as robust geometry. Do not lower target further without a distinct safety rationale."}}
