{"run":1,"status":"discard","metric":37,"description":"Hybrid base fallback and smooth regrasp; targeted wins did not survive full 50-seed run.","asi":{"hypothesis":"Per-seed recovery changes caused regressions; next test: attach cup in mplib after confirmed grasp to remove false planning collisions.","next_focus":"planning-world attached-object geometry"}}
{"type":"config","name":"TakeItBack planner geometry to 50/50","metricName":"success_count","metricUnit":"","bestDirection":"higher"}
{"run":2,"commit":"36b58ca","metric":37,"metrics":{"observed_runs":50,"failure_Task_aborted":11,"failure_Task_completed":2},"status":"discard","description":"Closed-loop fallback/regrasp candidate; full 50-seed result unchanged at 37/50.","timestamp":1787946643039,"segment":1,"confidence":null,"asi":{"hypothesis":"Existing fallback changes did not improve aggregate. Need structural pre-grasp geometry and placement strategy, not more retries.","next_focus":"replace straight-arm fixed geometry with reachable approach pose"}}
{"run":3,"commit":"fc1aa08","metric":0,"metrics":{"observed_runs":50,"failure_Task_aborted":23,"failure_Task_completed":0},"status":"discard","description":"Tighter transport/return waypoint tolerance; caused long or incomplete remote runs and 0/50 parsed successes.","timestamp":1787949947105,"segment":1,"confidence":null,"asi":{"hypothesis":"Global tighter screw convergence is incompatible with noisy base planner; preserve coarse navigation and solve placement locally.","next_focus":"separate coarse base transport from local tray-centering geometry"}}
{"run":4,"commit":"2778e26","metric":2,"metrics":{"observed_runs":50,"failure_Task_aborted":48,"failure_Task_completed":0},"status":"discard","description":"Measured held-cup centering with velocity correction before placement/return; regressed to 2/50.","timestamp":1787951691331,"segment":1,"confidence":null,"asi":{"hypothesis":"Velocity correction is unreliable near held-object geometry and causes aborts; retain coarse transport and focus on release/regrasp contract.","next_focus":"non-contact release retreat and live-pose regrasp"}}
{"run":5,"commit":"5ef11fe","metric":16,"metrics":{"observed_runs":50,"failure_Task_aborted":32,"failure_Task_completed":2},"status":"discard","description":"Open-gripper retreat before settling; reduced reliability to 16/50 despite avoiding some lateral release kicks.","timestamp":1787953868005,"segment":1,"confidence":null,"asi":{"hypothesis":"Arm retreat introduces IK/collision failures and is worse than stationary release. Revert; need robust pre-grasp and transport geometry.","next_focus":"correct Stage 3 approach orientation and reachable wrist geometry"}}
{"run":6,"commit":"3aaa16c","metric":0,"metrics":{"observed_runs":0,"failure_Task_aborted":0,"failure_Task_completed":0},"status":"crash","description":"Remote benchmark did not start: rsync to gangway failed after 139s; no runs produced.","timestamp":1787972507190,"segment":1,"confidence":null,"asi":{"hypothesis":"Pending grasp-probe candidate was ready for full 50-seed validation.","rollback_reason":"Infrastructure failure, not planner result; harness reverted uncommitted candidate per crash policy.","next_action_hint":"Retry remote benchmark; if transport remains unavailable, run targeted local arm-bending probe."}}
{"run":7,"commit":"d2e2292","metric":40,"metrics":{"observed_runs":50,"failure_Task_aborted":7,"failure_Task_completed":3},"status":"keep","description":"Bend arm at high transport height before staging; use live bent TCP offset for pre-grasp. Full remote 50/10 improved 37→40.","timestamp":1787974164282,"segment":1,"confidence":0.25,"asi":{"hypothesis":"A moderate elbow bend (shoulder -0.60, elbow +1.20, wrist -0.60) shortens TCP offset, raises elbow clear of fixtures, and gives IK a less stretched pre-grasp.","result":"Improved 40/50; local former failures 10/13 succeeded. Remaining failures need arm/grasp or final placement analysis.","next_action_hint":"User allows 20 workers; run next full benchmark at workers=20 only after updating measure harness or use 20-worker remote command."}}
{"run":8,"commit":"677ee6b","metric":40,"metrics":{"observed_runs":50,"failure_Task_aborted":7,"failure_Task_completed":3},"status":"keep","description":"20-worker remote confirmation: bent-arm candidate remains 40/50; same result as 10-worker run.","timestamp":1787975296152,"segment":1,"confidence":1,"asi":{"hypothesis":"Higher remote concurrency might expose planner races or alter success distribution; 20 workers should preserve 40/50 if geometry is stable.","result":"Confirmed identical 40/50 at 20 workers; no concurrency regression.","next_action_hint":"Keep bent carry pose. Analyze seven remaining failures by terminal stage before changing geometry."}}
{"run":9,"commit":"97ed801","metric":43,"metrics":{"observed_runs":50,"failure_Task_aborted":5,"failure_Task_completed":2},"status":"keep","description":"Use milder bent carry pose plus live front-grasp fallback and guarded torso descent; 20-worker remote run improved 40→43/50.","timestamp":1787977697328,"segment":1,"confidence":2,"asi":{"hypothesis":"Strong bend made some grasp poses unreachable; milder shoulder -0.40/elbow +0.80/wrist -0.40 preserves high elbow while leaving IK margin. Live front grasp and vertical torso closure recover staged vertical stalls.","result":"43/50, up from bent .60 baseline 40/50; local former failure seed35 recovered. Remaining failures need transport slip/final settling and edge grasp analysis.","next_action_hint":"Analyze five aborted and two metric failures; next change should target measured terminal causes, not add retries."}}
{"run":10,"commit":"a518f42","metric":47,"metrics":{"observed_runs":50,"failure_Task_aborted":2,"failure_Task_completed":1},"status":"keep","description":"Close/regrasp at release pose and verify with short lift; skip redundant Stage 9 lift. 20-worker remote run improved 43→47/50.","timestamp":1787979009396,"segment":1,"confidence":3.3333333333333335,"asi":{"hypothesis":"Most remaining failures were caused by lowering/regrasping after the cup had shifted, then accepting contact-only grasp; release-pose close plus lift proof should preserve coupling.","result":"47/50; recovered three aborted regrasp/lift failures and one? Remaining two aborts plus one final metric failure need targeted transport/settling analysis.","next_action_hint":"Inspect three failed seeds. Keep arm bend and release-pose lift gate; next change only measured terminal failure."}}
{"run":11,"commit":"7658bea","metric":48,"metrics":{"observed_runs":50,"failure_Task_aborted":1,"failure_Task_completed":1},"status":"keep","description":"Use fixed-arm screw L-transport with 5 cm detour; 20-worker remote run improved 47→48/50 and removed transport reversal failure.","timestamp":1787980032672,"segment":1,"confidence":2.2,"asi":{"hypothesis":"Stage 5/10 failures came from velocity/screw base reversals while holding bent arm; fixed-arm TCP-preserving screw segments keep payload transform stable.","result":"48/50; seed46 transport recovered locally and remote failures reduced to one abort plus one terminal metric failure.","next_action_hint":"Analyze two remaining seeds; likely regrasp relocation and final settling."}}
{"run":12,"commit":"7658bea","metric":48,"metrics":{"observed_runs":50,"failure_Task_aborted":1,"failure_Task_completed":1},"status":"discard","description":"Elevated above-tray regrasp fallback did not improve 48/50 in full 20-worker run; aggregate unchanged.","timestamp":1787981090995,"segment":1,"confidence":1.5714285714285714,"asi":{"hypothesis":"Seed23-style cup displacement could be recovered by an elevated bent-arm front approach before low regrasp.","rollback_reason":"Full benchmark stayed at 48/50; no aggregate gain over current best.","next_action_hint":"Keep fixed-arm transport and release-pose lift gate; target remaining regrasp/final metric failure with a different minimal change."}}
{"run":13,"commit":"7658bea","metric":48,"metrics":{"observed_runs":50,"failure_Task_aborted":1,"failure_Task_completed":1},"status":"discard","description":"Live base-centering before elevated regrasp kept benchmark at 48/50; no aggregate gain.","timestamp":1787982281791,"segment":1,"confidence":1.8333333333333333,"asi":{"hypothesis":"After release shift, exact TCP/cup offset plus fixed-arm base screw would avoid stack collision and recover regrasp.","rollback_reason":"Full 20-worker run unchanged at 48/50.","next_action_hint":"Discard generic regrasp fallback. Focus seed23 tray centering/release contract or seed35 placement latch."}}
{"run":14,"commit":"7658bea","metric":48,"metrics":{"observed_runs":50,"failure_Task_aborted":1,"failure_Task_completed":1},"status":"discard","description":"Slower Stage 7 jaw opening fixed local seed35 but full 20-worker aggregate stayed 48/50.","timestamp":1787984025165,"segment":1,"confidence":2.2,"asi":{"hypothesis":"Lower jaw-opening rate would reduce release torque and prevent seed35 cup spin.","rollback_reason":"Remote metric unchanged; local improvement did not generalize to batch.","next_action_hint":"Do not alter release timing globally. Target seed23 regrasp or use validated 50/50 straight-arm branch."}}
{"run":15,"commit":"1940b0f","metric":49,"metrics":{"observed_runs":50,"failure_Task_aborted":1,"failure_Task_completed":0},"status":"keep","description":"Use fixed-arm screw for Stage 1/2 and preserve mild bent carry pose; 20-worker remote run improved 48→49/50.","timestamp":1787984780958,"segment":1,"confidence":3.4285714285714284,"asi":{"hypothesis":"Noisy initial base staging was still moving the bent arm/cup off the ideal pre-grasp corridor; fixed-arm screw geometry should keep live TCP offset stable before grasp.","result":"49/50; local seeds23/35 centered and completed. One remote abort remains.","next_action_hint":"Inspect final failed seed and make one targeted correction; avoid broad strategy changes."}}
{"run":16,"commit":"b509821","metric":50,"metrics":{"observed_runs":50,"failure_Task_aborted":0,"failure_Task_completed":0},"status":"keep","description":"Raise torso to transport height after Stage 8 lift-test before Stage 10 return; 20-worker remote run reached 50/50.","timestamp":1787985781737,"segment":1,"confidence":4.333333333333333,"asi":{"hypothesis":"Stage 8 direct lift leaves the bent forearm low; Stage 10 fixed-arm screw rejects its start state near fixtures. Torso raise clears arm without redundant TCP lift.","result":"50/50 terminal successes, target reached.","next_action_hint":"Stop geometry optimization; run final diagnostics only and preserve bend/fixed-arm/regrasp changes."}}
{"run":17,"commit":"178bd87","metric":50,"metrics":{"observed_runs":50,"failure_Task_aborted":0,"failure_Task_completed":0},"status":"keep","description":"Repeated final 20-worker benchmark; 50/50 confirmed again.","timestamp":1787986639819,"segment":1,"confidence":5.2,"asi":{"hypothesis":"Previous 50/50 result should reproduce under independent remote run.","result":"Confirmed 50/50 with no aborted or incomplete runs.","next_action_hint":"Stop optimization; preserve current planner."}}
{"type":"config","name":"TakeItBack planner 100-seed robustness","metricName":"success_count","metricUnit":"","bestDirection":"higher"}
{"run":18,"commit":"25f31bc","metric":0,"metrics":{},"status":"crash","description":"Baseline remote benchmark did not start: rsync to gangway failed; no runs produced.","timestamp":1788179207415,"segment":2,"confidence":null,"asi":{"hypothesis":"Current planner baseline remains validated 50/50 and 100/100, but runtime baseline could not be measured because remote sync failed.","rollback_reason":"Infrastructure failure, not planner result; no benchmark output or logs were produced.","next_action_hint":"Retry remote benchmark once remote rsync recovers; meanwhile inspect pre-grasp step budget for a minimal runtime experiment."}}
{"run":19,"commit":"89aad1e","metric":100,"metrics":{"observed_runs":100,"wall_time_s":1471.4},"status":"keep","description":"Current validated planner baseline: 100/100 on 100 seeds; remote batch wall time 1471.4 s.","timestamp":1788180818010,"segment":2,"confidence":null,"asi":{"hypothesis":"Measure current 100-seed baseline before shortening pre-grasp motion ramps.","result":"100/100; runtime baseline 1471.4 s. Pre-grasp code still spends fixed 150+250+120+120 simulation steps before first grasp attempt.","next_action_hint":"Test one-at-a-time reductions of pre-grasp ramp steps, starting with torso and pan ramps; retain full-seed success gate."}}
{"type":"config","name":"TakeItBack planner runtime with 100-seed safety gate","metricName":"planner_median_s","metricUnit":"s","bestDirection":"lower"}
{"run":20,"commit":"c779cc7","metric":287.462984,"metrics":{"success_count":100,"observed_runs":100,"pregrasp_median_s":128.716506,"batch_wall_s":1471.4},"status":"keep","description":"New runtime baseline from existing full 100-seed run: 100/100; median planner time 287.463 s, median pre-grasp time 128.717 s.","timestamp":1788181017629,"segment":3,"confidence":null,"asi":{"hypothesis":"Use per-seed event timestamps as runtime metric, with success_count=100 as hard safety gate; remote batch wall time remains a noisy secondary.","result":"Baseline established from 100 completed seeds. Stage 0 accounts for most pre-grasp steps; measure now reports planner and pre-grasp medians.","next_action_hint":"Shorten Stage 0 torso/pan/arm ramps together conservatively, then require 100/100 and lower median runtime."}}
{"run":21,"commit":"c779cc7","metric":0,"metrics":{"success_count":0,"observed_runs":0,"pregrasp_median_s":0,"batch_wall_s":132.7},"status":"crash","description":"Candidate benchmark did not start: remote SSH connection closed before run directory creation; no seeds produced.","timestamp":1788181221448,"segment":3,"confidence":null,"asi":{"hypothesis":"Conservative pre-grasp ramp reductions (torso 150→100, pan 250→150, arm 120→80, grasp torso 120→80) were ready for validation.","rollback_reason":"Infrastructure failure, not planner result; remote benchmark produced zero logs.","next_action_hint":"Analyze existing 100-seed event logs for idle/compute-heavy stages while remote access recovers; rerun candidate later."}}
{"run":22,"commit":"c779cc7","metric":298.917995,"metrics":{"pregrasp_median_s":96.137169,"success_count":98,"observed_runs":100,"batch_wall_s":1470},"status":"discard","description":"Shortened Stage 0/2 ramps and arm pan ramp; pre-grasp median fell 128.72→96.14 s, but planner median worsened 287.46→298.92 s and reliability fell to 98/100.","timestamp":1788182822627,"segment":3,"confidence":null,"asi":{"hypothesis":"Reducing torso 150→100, pan 250→150, arm bend 120→80, and pre-grasp torso 120→80 would remove idle-looking ramp time without changing geometry.","result":"Pre-grasp was 25% faster, but two failures and slower total runtime show ramps provide needed settling/trajectory stability; candidate over-aggressive or changes interact with later stages.","rollback_reason":"Primary runtime regressed and success gate missed 100/100; automatic discard restored baseline planner.","next_action_hint":"Measure stage-3 planner waits and isolate one reduction at a time; do not repeat combined ramp cut."}}
{"run":23,"commit":"c779cc7","metric":320.54843,"metrics":{"pregrasp_median_s":121.098504,"success_count":98,"observed_runs":100,"batch_wall_s":1562.4},"status":"discard","description":"Shortened only Stage 0 torso/pan/arm ramps; pre-grasp improved 128.72→121.10 s, but total median worsened 287.46→320.55 s and result fell to 98/100.","timestamp":1788184601458,"segment":3,"confidence":null,"asi":{"hypothesis":"Stage 0 is slowest pre-grasp block; reducing torso 150→100, pan 250→150, arm bend 120→80 while keeping Stage 2 torso ramp should preserve downstream stability.","result":"Still regressed despite retaining Stage 2. Faster Stage 0 causes later trajectory/refinement cost or failures; fixed ramp shortening is not a safe speed win.","rollback_reason":"Primary runtime regressed and 100/100 safety gate failed; automatic discard restored baseline.","next_action_hint":"Do not shorten physical ramps further. Target actual no-motion loops: Stage 3 refinement and release settling, with explicit path/velocity guards."}}
{"run":24,"commit":"c779cc7","metric":288.481521,"metrics":{"pregrasp_median_s":129.249657,"success_count":100,"observed_runs":100,"batch_wall_s":1464.6},"status":"discard","description":"Skipped refinement in Stage 3 screw reaches; 100/100 preserved but median planner time 287.46→288.48 s and pre-grasp time slightly worsened.","timestamp":1788186384685,"segment":3,"confidence":null,"asi":{"hypothesis":"Stage 3 `Robot is stuck` comes from refinement-only idle steps; direct masked screw execution should remove them without changing path.","result":"No speed gain; direct execution was 1.02 s slower within noise. Reliability stayed 100/100.","rollback_reason":"Primary runtime unchanged/slightly worse; automatic discard restored baseline.","next_action_hint":"Use requested 10-worker benchmark for runtime comparison; keep Stage 3 baseline and focus on measured no-motion outliers only."}}
{"type":"config","name":"TakeItBack planner runtime with 50-seed safety gate at 10 workers","metricName":"planner_median_s","metricUnit":"s","bestDirection":"lower"}
{"run":25,"commit":"6bcafbb","metric":119.677302,"metrics":{"success_count":50,"observed_runs":50,"pregrasp_median_s":53.525043,"batch_wall_s":863.7},"status":"keep","description":"50-seed, 10-worker baseline: 50/50; median planner time 119.677 s and median pre-grasp time 53.525 s.","timestamp":1788187286221,"segment":4,"confidence":null,"asi":{"hypothesis":"Rebaseline requested 50-seed benchmark at 10 workers before speed changes; success remains hard gate.","result":"Current planner reproduced 50/50. Stage 0 remains dominant pre-grasp block; no-motion Stage 3 is smaller, while release settling only becomes pathological after unstable motion.","next_action_hint":"Use 10-worker runs for fair comparison; test no-motion optimization only if it lowers runtime without changing physical ramps."}}
{"run":26,"commit":"6bcafbb","metric":147.691728,"metrics":{"success_count":50,"observed_runs":50,"pregrasp_median_s":69.459255,"batch_wall_s":948},"status":"discard","description":"Shortened only initial torso ramp 150→100; 50/50 preserved, but median planner time worsened 119.68→147.69 s and pre-grasp time increased.","timestamp":1788188313764,"segment":4,"confidence":null,"asi":{"hypothesis":"Initial torso ramp alone was unnecessary overhead; removing 50 steps should reduce pre-grasp latency while leaving pan/arm settling intact.","result":"No speed win; slower downstream execution despite 50/50. The longer baseline ramp likely stabilizes torso/arm before planning and transport.","rollback_reason":"Primary runtime regressed by 23.4%; automatic discard restored 150-step ramp.","next_action_hint":"Do not shorten physical ramps. Optimize only true idle waits, starting with robust release settle handling or eliminate redundant planner calls."}}
{"run":27,"commit":"6bcafbb","metric":98.437467,"metrics":{"success_count":50,"observed_runs":50,"pregrasp_median_s":46.854929,"batch_wall_s":824.3},"status":"discard","description":"Disabled solver verbose logging; 50/50 and runtime improved, but user requires geometry-only optimization, so change intentionally discarded.","timestamp":1788189227999,"segment":4,"confidence":null,"asi":{"hypothesis":"Per-step verbose action logging was runtime overhead, not planner geometry.","result":"Median planner time improved 119.68→98.44 s and pre-grasp 53.53→46.85 s, confirming logging cost.","rollback_reason":"Explicit user constraint: do not optimize by disabling verbose; keep diagnostics output unchanged.","next_action_hint":"Optimize geometric path/phase strategy only; preserve verbose=True."}}
{"run":28,"commit":"0615e99","metric":103.260625,"metrics":{"success_count":50,"observed_runs":50,"pregrasp_median_s":38.72011,"batch_wall_s":672.6},"status":"keep","description":"Combined high-torso pan+bend into one 180-step arm path; 50/50, planner median 119.68→103.26 s, pre-grasp 53.53→38.72 s.","timestamp":1788189964112,"segment":4,"confidence":1.545838468142525,"asi":{"hypothesis":"Sequential pan ramp (250) then elbow bend (120) repeats same high-clearance corridor. One joint-space path to identical bent pose should preserve geometry while removing 190 simulation steps.","result":"50/50 preserved. Median pre-grasp improved 27.7%; total planner improved 13.7%; batch wall 863.7→672.6 s. Geometry-only speedup validated.","next_action_hint":"Keep combined path. Repeat 50/10 for noise confirmation before any further geometry change; do not disable verbose or alter evaluation."}}
{"run":29,"commit":"184cd08","metric":101.072977,"metrics":{"success_count":50,"observed_runs":50,"pregrasp_median_s":37.904972,"batch_wall_s":665.5},"status":"keep","description":"Repeat combined pan+bend geometry: 50/50 confirmed; planner median 103.26→101.07 s, pre-grasp 38.72→37.90 s.","timestamp":1788190640853,"segment":4,"confidence":3.8572912187409116,"asi":{"hypothesis":"Previous geometry speedup should reproduce at requested 10-worker concurrency.","result":"Second independent 50/10 run also 50/50. Median planner 101.07 s; pre-grasp 37.90 s; batch wall 665.5 s. Improvement is repeatable.","next_action_hint":"Keep combined 180-step arm path. Test only one further structural reduction if it preserves 50/50; otherwise finish with repeated confirmation."}}
