{"run":30,"commit":"184cd08","metric":115.593089,"metrics":{"success_count":49,"observed_runs":50,"pregrasp_median_s":40.487806,"batch_wall_s":816.2},"status":"discard","description":"Shortened combined pan+bend arm path 180→160 steps; 49/50 and median planner 115.59 s, worse than validated 180-step path.","timestamp":1788191502687,"segment":4,"confidence":2,"asi":{"hypothesis":"The combined high-torso path has enough clearance margin to run 20 steps faster.","result":"One abort and slower runtime; 160 steps is beyond reliable geometry margin.","rollback_reason":"Missed 50/50 safety gate and primary runtime regressed; automatic discard restored 180 steps.","next_action_hint":"Keep 180-step combined path as speed/reliability frontier; no more aggressive arm ramp cuts."}}
{"run":31,"commit":"184cd08","metric":103.925832,"metrics":{"success_count":49,"observed_runs":50,"pregrasp_median_s":38.061244,"batch_wall_s":690.8},"status":"discard","description":"Tested 170-step combined pan+bend geometry; 49/50, so no improvement over validated 180-step path.","timestamp":1788192336880,"segment":4,"confidence":3.3897754613623543,"asi":{"hypothesis":"A 10-step reduction from validated 180 should retain clearance margin while trimming pre-grasp time.","result":"One abort at 49/50; median planner 103.93 s and pre-grasp 38.06 s, not better than confirmed 180-step result.","rollback_reason":"Safety gate failed; automatic discard restored 180 steps.","next_action_hint":"Stop reducing arm-path duration. Next structural candidate should remove redundant base waypoints without changing arm dynamics."}}
{"run":32,"commit":"184cd08","metric":104.714563,"metrics":{"success_count":49,"observed_runs":50,"pregrasp_median_s":39.769513,"batch_wall_s":811.4},"status":"discard","description":"Conditional pure-y l_drive detour removal; 49/50 and median planner 104.71 s, worse than validated 180-step geometry.","timestamp":1788193252731,"segment":4,"confidence":4.075449035816285,"asi":{"hypothesis":"Pure y legs do not need the 5 cm detour used to break pure-x screw degeneracy; removing it should save base-plan waypoints without affecting x transport.","result":"One abort and slower runtime; the detour also contributes needed staging clearance or timing even on pure-y calls.","rollback_reason":"Safety gate failed and primary runtime regressed; automatic discard restored unconditional detour.","next_action_hint":"Keep l_drive route unchanged. Validated frontier remains combined 180-step pan+bend geometry; avoid further waypoint deletion without per-seed safety evidence."}}
{"run":33,"commit":"184cd08","metric":105.679734,"metrics":{"success_count":50,"observed_runs":50,"pregrasp_median_s":41.639606,"batch_wall_s":827.4},"status":"discard","description":"Removed redundant Stage 1 out-and-back base segment while preserving south safety corridor; 50/50 but slower than validated 180-step path.","timestamp":1788194220705,"segment":4,"confidence":5.108852296773984,"asi":{"hypothesis":"Starting first Stage 1 l-drive at south_line+5 cm should preserve x-leg clearance and eliminate one 5 cm return/re-entry segment.","result":"50/50 preserved, but median planner 105.68 s and pre-grasp 41.64 s exceeded validated 101.07/37.90 s; no speed gain.","rollback_reason":"Primary runtime regressed despite unchanged success; automatic discard restored original Stage 1 waypoint.","next_action_hint":"Do not remove Stage 1 waypoints. Keep validated combined pan+bend path and original safety route."}}
{"run":34,"commit":"184cd08","metric":109.158796,"metrics":{"success_count":50,"observed_runs":50,"pregrasp_median_s":38.242334,"batch_wall_s":726.2},"status":"discard","description":"Tested 80° pan with 170-step combined path; 50/50 preserved, but median planner 109.16 s regressed versus validated 101.07 s.","timestamp":1788195044600,"segment":4,"confidence":4.601716907093765,"asi":{"hypothesis":"Extra shoulder-pan margin should make a shorter 170-step path as stable as 180 steps while keeping joint speed comparable.","result":"Success intact, but runtime worse; pan angle change likely increases base correction/IK work enough to erase 10-step saving.","rollback_reason":"Primary runtime regressed by 8.0%; automatic discard restored 85°/180-step geometry.","next_action_hint":"Keep validated 85° pan and 180-step combined path; no more arm-speed tuning. Focus on a different geometry contract only if it has measured path reduction."}}
{"run":35,"commit":"184cd08","metric":107.799941,"metrics":{"success_count":48,"observed_runs":50,"pregrasp_median_s":41.943241,"batch_wall_s":738.7},"status":"discard","description":"Reduced south staging margin 0.40→0.30 m; success fell to 48/50 and median planner rose to 107.80 s.","timestamp":1788195931971,"segment":4,"confidence":5.347511771851151,"asi":{"hypothesis":"The arm's high TCP should still clear the cup with a 30 cm south corridor, reducing Stage 1/2 base travel.","result":"Two aborts show 40 cm margin is load-bearing for collision-free staging; no speed gain.","rollback_reason":"Safety gate failed and runtime regressed; automatic discard restored 0.40 m corridor.","next_action_hint":"Keep validated corridor and 180-step arm path. Avoid further clearance reductions; seek speed in already collision-free geometry."}}
{"run":36,"commit":"184cd08","metric":115.175689,"metrics":{"success_count":50,"observed_runs":50,"pregrasp_median_s":42.971249,"batch_wall_s":723.1},"status":"discard","description":"Fresh 50/10 confirmation of unchanged validated geometry: 50/50, but median runtime 115.18 s was above best 101.07 s; no code change retained.","timestamp":1788196803093,"segment":4,"confidence":4.068265145051877,"asi":{"hypothesis":"After multiple rejected shortcuts, repeat accepted 85°/180-step geometry to check that 50/50 reliability is not a lucky batch.","result":"50/50 confirmed again. Runtime was noisy/slower than best, so no new optimization claim.","rollback_reason":"No code candidate and primary runtime did not beat best; discard records confirmation without changing planner.","next_action_hint":"Keep 85°/180-step combined path. Treat 101.07 s as best observed and require a real geometry win before replacing it."}}
{"run":37,"commit":"184cd08","metric":103.574461,"metrics":{"success_count":50,"observed_runs":50,"pregrasp_median_s":39.015362,"batch_wall_s":693.7},"status":"discard","description":"Relaxed Stage 0 base alignment tolerance 4°→8°; 50/50 preserved but median planner 103.57 s exceeded best 101.07 s.","timestamp":1788197582582,"segment":4,"confidence":5.347511771851151,"asi":{"hypothesis":"Fixed-arm world-coordinate transport does not need exact east heading; stopping within 8° should remove variable rotation steps from Stage 0.","result":"No runtime win; remaining yaw error likely adds downstream correction/IK work that cancels saved rotation.","rollback_reason":"Primary runtime did not improve; automatic discard restored 4° alignment.","next_action_hint":"Keep exact base alignment and validated 180-step arm path. Avoid trading heading margin for small step savings."}}
{"run":38,"commit":"184cd08","metric":108.925495,"metrics":{"success_count":50,"observed_runs":50,"pregrasp_median_s":39.269016,"batch_wall_s":700.6},"status":"discard","description":"Lowered Stage 2 grasp torso target by 3 cm; 50/50 preserved but median planner 108.93 s exceeded validated 101.07 s.","timestamp":1788198546602,"segment":4,"confidence":5.599842217479532,"asi":{"hypothesis":"Starting TCP 3 cm closer to the cup should shorten Stage 3 grasp geometry and reduce pre-grasp time.","result":"No speed gain; lower torso target likely adds contact/IK correction cost that offsets the shorter final reach.","rollback_reason":"Primary runtime regressed; automatic discard restored TORSO_GRASP target.","next_action_hint":"Keep validated torso height, 85° pan, 180-step combined path. Avoid further grasp-height reductions without a stronger geometric clearance argument."}}
{"run":39,"commit":"184cd08","metric":103.340194,"metrics":{"success_count":50,"observed_runs":50,"pregrasp_median_s":38.276074,"batch_wall_s":668.7},"status":"discard","description":"Fixed torso in fixed-arm base screws; 50/50 preserved but median planner 103.34 s exceeded validated 101.07 s.","timestamp":1788199358158,"segment":4,"confidence":5.73188383248181,"asi":{"hypothesis":"Horizontal TCP translation only needs base x/y/yaw; removing unnecessary torso DOF should reduce screw search and keep arm/torso geometry rigid.","result":"Success stayed 50/50, but runtime was 2.2% slower than best; extra torso DOF may help planner settle around fixture geometry despite no visible torso motion.","rollback_reason":"Primary runtime regressed; automatic discard restored base+torso mask.","next_action_hint":"Keep validated 85°/180-step geometry and original screw mask. No further DOF reductions without a measured win."}}
{"run":40,"commit":"184cd08","metric":101.936008,"metrics":{"success_count":50,"observed_runs":50,"pregrasp_median_s":37.163849,"batch_wall_s":666.2},"status":"discard","description":"Overlapped final torso rise with the 180-step pan+bend path; 50/50 preserved, but median planner 101.94 s was slightly slower than validated 101.07 s.","timestamp":1788200302564,"segment":4,"confidence":5.323516589987222,"asi":{"hypothesis":"Raising torso to 0.33 m before rotation and completing the final 0.056 m during arm motion should remove serial Stage 0 time without changing final arm geometry.","result":"50/50 and pre-grasp 37.16 s held, but total median did not beat best; overlap adds dynamics that erase the saved steps.","rollback_reason":"Primary runtime 0.9% worse than validated best; automatic discard restored serial 150-step torso ramp and 180-step arm path.","next_action_hint":"Do not overlap torso/arm further. Keep validated 85°/180-step geometry; current physical safety margin appears near frontier."}}
{"run":41,"commit":"fe9d7aa","metric":89.667693,"metrics":{"success_count":50,"observed_runs":50,"pregrasp_median_s":30.029807,"batch_wall_s":600},"status":"keep","description":"Fused Stage 2 torso lowering into first Stage 3 high-to-intermediate grasp screw, with low-torso fallback; 50/50 and planner median 101.07→89.67 s.","timestamp":1788201021762,"segment":4,"confidence":8.240807439395903,"asi":{"hypothesis":"The proven grasp screw already controls torso+arm; removing the serial 120-step Stage 2 torso ramp should shorten pre-grasp while fallback preserves old contract on inaccurate reaches.","result":"50/50 preserved. Planner median improved 11.3%; pre-grasp 37.90→30.03 s; batch completed with 50 observed runs. Geometry fusion is a real speed win.","next_action_hint":"Keep fused high-to-intermediate path. Repeat 50/10 to confirm before testing any further geometric reduction."}}
{"run":42,"commit":"d6ce6e0","metric":87.621869,"metrics":{"success_count":50,"observed_runs":50,"pregrasp_median_s":29.550041,"batch_wall_s":591.8},"status":"keep","description":"Repeat fused Stage 2→Stage 3 geometry at 50/10: 50/50 confirmed; planner median 89.67→87.62 s, pre-grasp 30.03→29.55 s.","timestamp":1788201655704,"segment":4,"confidence":7.9295659725164125,"asi":{"hypothesis":"Fused high-to-intermediate grasp path is repeatable and not a one-batch runtime outlier.","result":"Second independent 50/10 run succeeded 50/50. Median planner 87.62 s; pre-grasp 29.55 s; batch wall 591.8 s.","next_action_hint":"Keep fused path and safety fallback. Require any next geometry change to beat 87.62 s while preserving 50/50."}}
{"run":43,"commit":"d6ce6e0","metric":94.382574,"metrics":{"success_count":48,"observed_runs":50,"pregrasp_median_s":29.350538,"batch_wall_s":647.9},"status":"discard","description":"Replaced final 5 cm Stage 3 IK screw with vertical torso closure; median pre-grasp 29.35 s but reliability fell to 48/50.","timestamp":1788202464501,"segment":4,"confidence":6.411518736362832,"asi":{"hypothesis":"After reaching intermediate pose, same-orientation vertical closure should be safer and cheaper than a second IK screw; static final remains fallback.","result":"Two terminal failures despite lower runtime; vertical closure changed grasp contact/torso state enough to break downstream behavior.","rollback_reason":"Safety gate failed at 48/50; automatic discard restored second static grasp screw and 30-step fallback descent.","next_action_hint":"Keep fused high-to-intermediate path plus original final IK contract. Do not replace final screw with torso-only closure."}}
{"run":44,"commit":"d6ce6e0","metric":85.092726,"metrics":{"success_count":49,"observed_runs":50,"pregrasp_median_s":29.309829,"batch_wall_s":588.1},"status":"discard","description":"Reduced Stage 4 four-centimeter lift probe 40→30 steps; runtime fell to 85.09 s but safety gate dropped to 49/50.","timestamp":1788203120780,"segment":4,"confidence":6.112766480028466,"asi":{"hypothesis":"A 25% faster 4-cm probe should preserve the lift-coupling check while removing 10 physical steps.","result":"One failure despite faster median; probe timing is load-bearing for grasp stability.","rollback_reason":"Missed 50/50 safety gate; automatic discard restored 40-step probe.","next_action_hint":"Do not shorten held-cup validation ramps. Keep fused pre-grasp path and original Stage 4 probe."}}
{"run":45,"commit":"d6ce6e0","metric":87.903113,"metrics":{"success_count":50,"observed_runs":50,"pregrasp_median_s":30.032717,"batch_wall_s":596.1},"status":"discard","description":"Midpoint Stage 4 lift probe 35 steps; 50/50 preserved, but median planner 87.90 s was above validated 87.62 s.","timestamp":1788203781919,"segment":4,"confidence":5.990511927227523,"asi":{"hypothesis":"A midpoint between unsafe 30 and safe 40 probe steps could retain coupling while removing 5 physical steps.","result":"50/50 held, but no primary runtime improvement over 40-step validated probe; gain is below noise/absent.","rollback_reason":"Primary metric did not beat best; automatic discard restored 40-step probe.","next_action_hint":"Keep 40-step Stage 4 probe. Do not spend more iterations bracketing this held-cup timing; target another geometry only with a measurable path reduction."}}
{"run":46,"commit":"df1d015","metric":87.486173,"metrics":{"success_count":50,"observed_runs":50,"pregrasp_median_s":29.759373,"batch_wall_s":597.5},"status":"keep","description":"Added Stage 11 fail-fast when torso reaches floor; 50/50 and median planner 87.49 s, while avoiding repeated no-op lowering steps.","timestamp":1788204638653,"segment":4,"confidence":5.76404262412848,"asi":{"hypothesis":"Stage 11 sometimes repeats 300 steps after torso target is already at floor and cup cannot descend; breaking at floor should cut stalled tail without changing normal contact stop or evaluation.","result":"50/50 preserved; 12/50 runs hit the previous 300-step ceiling, and candidate median planner was 87.49 s versus 87.62 s baseline. This is a safe tail-latency geometry guard, though median gain is small.","next_action_hint":"Keep floor guard. Validate broader robustness before further changes; avoid touching validated grasp and transport ramps."}}
{"run":47,"commit":"df1d015","metric":89.99462,"metrics":{"success_count":50,"observed_runs":50,"pregrasp_median_s":30.338621,"batch_wall_s":601},"status":"discard","description":"Repeat Stage 11 floor-guard candidate: 50/50 confirmed, but median planner 89.99 s was above best 87.49 s; no code change retained.","timestamp":1788205279351,"segment":4,"confidence":5.532450750197386,"asi":{"hypothesis":"Floor guard should preserve reliability and tail-latency behavior across an independent 50/10 batch.","result":"50/50 confirmed again. Runtime variation exceeded the tiny prior median gain; no stronger speed claim from this repeat.","rollback_reason":"Primary runtime did not beat best; planner remains unchanged with guard already retained.","next_action_hint":"Keep guard as validated tail protection. Require a meaningful geometry improvement before further edits."}}
{"type":"config","name":"TakeItBack planner 100-seed robustness with floor guard","metricName":"planner_median_s","metricUnit":"s","bestDirection":"lower"}
{"run":48,"commit":"89714e5","metric":90.005243,"metrics":{"success_count":100,"observed_runs":100,"pregrasp_median_s":28.878296,"batch_wall_s":1127.4},"status":"keep","description":"100-seed, 10-worker robustness validation of fused grasp path plus Stage 11 floor guard: 100/100.","timestamp":1788206494920,"segment":5,"confidence":null,"asi":{"hypothesis":"Promoted safety validation from 50 to 100 seeds at requested 10-worker concurrency to rule out benchmark overfit before more optimization.","result":"100/100 successes; median planner 90.01 s, pre-grasp 28.88 s, 100 observed runs. Floor guard and fused high-to-intermediate path generalize.","next_action_hint":"Keep current planner as robust baseline. Any next optimization must beat 90.01 s and preserve 100/100, not merely 50/50."}}
{"run":49,"commit":"d159cdc","metric":89.311366,"metrics":{"success_count":100,"observed_runs":100,"pregrasp_median_s":28.763368,"batch_wall_s":1127.6},"status":"keep","description":"Fixed Stage 11 floor guard to use physical TORSO_LOW+1 mm; 100/100 and median planner 90.01→89.31 s.","timestamp":1788207886241,"segment":5,"confidence":null,"asi":{"hypothesis":"Previous floor guard checked 0.001, below controller's real 0.02 m lower limit, so 30% of 100 runs still repeated 300 no-op steps. Guarding at TORSO_LOW should eliminate that tail safely.","result":"100/100 preserved. Median planner improved 0.77%; pre-grasp 28.76 s; guard now matches physical actuator limit.","next_action_hint":"Keep corrected floor guard and 100-seed validation. Do not optimize below physical torso limit; next changes require new geometry evidence."}}
{"run":50,"commit":"d159cdc","metric":90.008457,"metrics":{"success_count":100,"observed_runs":100,"pregrasp_median_s":29.08116,"batch_wall_s":1134.6},"status":"discard","description":"Added no-descent fail-fast near torso floor; 100/100 preserved, but median planner 90.01 s exceeded validated 89.31 s.","timestamp":1788209150270,"segment":5,"confidence":215.89203484659473,"asi":{"hypothesis":"Stage 11 repeats stationary lowering after contact; 10 no-descent samples near floor should cut stuck tails without changing normal surface-height stop.","result":"No median speed gain on 100 seeds; runtime was effectively baseline/noisier, so guard adds complexity without measurable primary improvement.","rollback_reason":"Primary metric regressed versus validated 89.31 s; automatic discard restored simple physical-floor guard.","next_action_hint":"Keep only TORSO_LOW floor guard. Stop optimizing Stage 11 lowering; target a different geometry with measured median impact."}}
{"run":51,"commit":"d159cdc","metric":89.366855,"metrics":{"success_count":100,"observed_runs":100,"pregrasp_median_s":29.034783,"batch_wall_s":1130.8},"status":"discard","description":"Raised Stage 11 counter lowering step from 5.0 to 5.5 mm; 100/100 preserved but median planner 89.37 s exceeded validated 89.31 s.","timestamp":1788210383348,"segment":5,"confidence":2.162951487058893,"asi":{"hypothesis":"Counter lowering was a remaining moving block; a modest 10% larger torso step should shorten contact approach without affecting tray placement.","result":"No primary speed gain on 100 seeds; success stayed 100/100 and median was slightly slower within noise.","rollback_reason":"Primary runtime did not improve; automatic discard restored 5.0 mm counter lowering.","next_action_hint":"Keep validated 5 mm lowering and physical floor guard. Stop tuning placement step size; target no other low-margin thresholds."}}
{"run":52,"commit":"d159cdc","metric":89.935123,"metrics":{"success_count":100,"observed_runs":100,"pregrasp_median_s":28.9387,"batch_wall_s":1130.7},"status":"discard","description":"Shortened Stage 9 post-lift torso raise 150→145 steps; 100/100 preserved but median planner 89.94 s exceeded validated 89.31 s.","timestamp":1788211640701,"segment":5,"confidence":9.461873073880614,"asi":{"hypothesis":"Stage 8 lift-test already proves cup attachment, so a 5-step shorter carry raise should clear fixtures without extra stability cost.","result":"100/100 held, but no primary runtime gain; 5-step reduction is within noise and not better than validated 150-step raise.","rollback_reason":"Primary runtime regressed versus 89.31 s; automatic discard restored 150-step Stage 9 raise.","next_action_hint":"Keep Stage 9 ramp unchanged. Current robust frontier remains fused grasp path plus physical floor guard."}}
{"run":53,"commit":"676fa0b","metric":85.259338,"metrics":{"success_count":100,"observed_runs":100,"pregrasp_median_s":29.449908,"batch_wall_s":1095.4},"status":"keep","description":"Reduced Stage 8 verified lift-test height 15→10 cm; 100/100 and median planner 89.31→85.26 s.","timestamp":1788212834600,"segment":5,"confidence":13.679384098334681,"asi":{"hypothesis":"Stage 8 only requires +5 cm cup rise for the attachment gate; a 10 cm target remains safely above tray while shortening the verified lift path.","result":"100/100 preserved on 100 seeds. Median planner improved 4.5%; batch wall 1095.4 s. Geometry change generalizes beyond 50-seed screening.","next_action_hint":"Keep 10 cm lift-test target. Revalidate 100/100 before any further reduction; do not weaken lift gate."}}
